{
  "$schema": "../registry.schema.json",
  "schema_version": "1.0",
  "style_version": "paper-cut-v1",
  "reference_boards": [
    {
      "id": "BOARD-PAPER-CUT-V1-LEGACY-01",
      "file": "designboard.png",
      "sha256": "7934cdf50d269322bba1a1a7eba2abf84ad8801c6af9fe9d8b02cc67e5af73d3",
      "status": "candidate",
      "generation_reference_allowed": false,
      "paper_preview": null,
      "notes": "기존 보드. 계약 일치 새 보드와 --paper 합성 미리보기 승인 전까지 생성 참조 금지."
    }
  ],
  "assets": []
}
